{
  "route_id": "BUR-93",
  "slug": "bur-93",
  "agency_id": "BURULAS",
  "name": {
    "tr": "Kent Meydanı - Heykel",
    "en": "Kent Square - Heykel"
  },
  "code": "93",
  "color": "#E30613",
  "sort_order": 1,
  "vehicle_type": "bus",
  "fare_id": "BUR-OTOBUS-TAM",
  "route_pattern": "round_trip",
  "stop_mode": "fixed",
  "updated_at": "2026-09-22T10:00:00Z"
}
